text,type
nbc,although new sanctuary coalition comprised multi faith institutions ragbir said roman catholic churches officially come board one open churches offering sanctuary nyc undocumented immigrants facing deportation wrote feel catholic church great work always told nbc latino im sure catholic church responsive individual actions although think pay attention said across country churches congregations rallied offer support undocumented immigrants facing deportation
nbc,ukrainian police provide protection annual gay pride march kiev ukraine capital june city embroiled gay rights row year hosted eurovision song contest slogan celebrate diversity kiev ukrainian politicians foreign diplomats joined thousands marching gay pride kiev sunday carrying banners waving rainbow ukrainian flags parade flanked thick cordon helmeted police ukrainian authorities increased support gay rights since pro western government took power following maidan protests relate hundreds thousands attend brazil massive pride paradebut critics say homophobic attitudes remain widespread
nbc,house veterans affairs committee chairman phil roe sponsor house measure said would support revisions congress difficulty coming agreement accountability bill phoenix va scandal christian petersen getty images filethe gop controlled house previously approved accountability bill mostly along party lines many veterans died waiting months appointments va employees created secret waiting lists falsehoods cover delays senate bill introduced thursday adopts several portions previous isakson bill including longer appeal process provided house bill days vs days though workers would paid appeal
nbc,jordan strauss ap carrie fisher daughter billie lourd released statement toxicology report revealed fisher cocaine heroin system time death fisher daughter actress billie lourd released statement people addressing findings monday toxicology report closed captioning apply reset x text displaybackgroundenhancements fonttimes new roman arial comic sanst sizecolor share link carrie fisher cause death released play video carrie fisher cause death released play video coroner office said could determine whether drugs contributed year old fisher death december saturday los angeles medical examiner initially listed sleep apnea undetermined factors cause fisher death share tweet pin emailcarrie fisher daughter spoken stigma drug addiction toxicology results revealed fisher cocaine heroin system time death last year
nbc,first syrian aircraft shot us militarysailors california connecticut killed cargo ship crashed side uss fitzgerald japan glaring question remains could happen us navy warship
nbc,international campaigner human rights watch reported cuban government long repressed dissent criticism gotten worse cuba country world trump allegedly cares human rights wrote michael mcfaul former u arbitrary arrests human rights defenders independent journalists others grown dramatically recent years says comes cuba massive systematic harm human rights comes blockade president trump proposes harden human rights watch warned however ordinary cubans people trump said move sought help would suffer result last weeks decision
nbc,white house press secretary sean spicer looking fill replacement according new politico report moreduration video duration momentjs morning joe panel discusses
nbc,first comments since may tiger woods said statement monday currently receiving professional help manage prescription medications monday woods wrote twitter im currently receiving professional help manage medications ways deal back pain sleep disorder may tigerwoods com woods wrote month since underwent fusion surgery back hard express much better feel alcohol involved woods said statement suffered unexpected reaction prescribed medications report june indicated woods told arresting officers taking xanax news comes three weeks woods charged driving influence found asleep wheel south florida
nbc,new report examines media influencing kidsa new report research nonprofit commonsense giving parents guidance keep gender stereotypes media much influence children nbcs joe fryer reports today
nbc,way amazon reversing strategy made big box retailers like walmart target players supermarket business portalatin pointed although percent people bought groceries online last month little half amazon prime members whole foods plus stores could one day mere grocery stores serving distribution hubs broader inventory amazon products happen whole foods stores really red flag retailers grocery witcher said
nbc,moreduration video duration momentjs john oliver among many noted almost never hear jared kushner speak public msnbc brian williams monday changed
nbc,steve thomashygienethough shouldnt sweat much filtered air ship youll need rethink personal hygiene standards youll need figure best way snuggle slightest nudge send flying clothes dont get dirty quickly space earth good need make last dont need pillow rest head virtually anywhere within spacecraft radiationastronauts international space station mostly protected space radiation earths magnetic field
nbc,dan gilbert consult lebron james prior parting david griffin sources said got us lebron james kingjames june lebron reportedly disappointed concerned decision james advocated griffin extension brian windhorst windhorstespn june lebron james came griffins defense maybe gilbert star struck maybe takes year television maybe team grabs consultant shall see
nbc,moreduration video duration momentjs democrats held senate floor late monday protest gop health care bill written behind closed doors sen tammy baldwin wi joins msnbc brian williams
nbc,related speedy delivery bots may change buying habitsjudging weve seen far conscious machines inherit human vulnerabilities fact thinks deliberately hold back building conscious machines avoid moral dilemmas poses youre building conscious systems work us would akin slavery schneider says beyond cool create robots researchers design cybernetic creatures theyre trying fix flaws machine learning systems although science fiction may us worried sentient robots really mindless robots need cautious
nbc,offhow president trump respond otto warmbiers death nbcs political analyst nicolle wallace discusses president donald trump might respond north korea following death otto warmbier
nbc,moscow condemned downing syrian jet dropped bombs near u backed syrian democratic forces fighting isis syria increasingly complicated civil war play facebooktwitterembed us war plane shoots syrian military jet autoplay autoplay copy code website blogescalating tensions region help anybody white house press secretary sean spicer said monday russia key ally syrian president bashar assad providing air cover government offensive since areas northern syria west euphrates controlled isis syrian government forces captured recent months forces aligned u campaign isis warned syrian government troops stop attacks face retaliation
nbc,stray voltage seeping lakes pools nearby electrical sources might even know today national investigative correspondent jeff rossen shows make sure pool safe electrical dangers story
nbc,hatch cut glass decanter crate barrelcrate barrel crate barrelcrate barrel crosshatched decanter elegant timeless addition home bar setup brown liquor loving pair chef n sweet spot ice cream maker sur la tablesur la tablethis compact ice cream maker perfect apartment dwellers sweet tooth passionate foodies sur la tablesur la table diy macaron kit sur la tablesur la tablewith heart shaped guides stenciled onto silicone mat plus variety decorating tips macaron making kit takes guess making notoriously tricky french cookies eppicotispai ravioli tortellini starter set sur la tablesur la tablethe eight piece pasta making set comes everything couple needs delicious date night home
nbc,american student otto warmbier speaks presented reporters pyongyang north korea february travel agency specializes north korea tours based central chinese city xi north korea accuses washington south korea sending spies overthrow government personally believe possible china step sanctions north korea china already tough considering facts tragic outcome longer organizing tours u citizens north korea
