text,type
cnn,white house press briefing dates back presidency william mckinley become hallmark american politics white house press briefing seen better days first time white house taken step month brought added twist monday briefing white house termed gaggle informal set though took place format much like briefing likewise camera audio broadcasting forbidden response networks like cnn decided broadcast audio briefing even without visual accompany white house barred attendees
cnn,gallup poll u employees said work hours week put hours tend get distracted typical working hours along lines may want take step back think working many hours first place gone days strolling work sharp clocking precisely eight hours later stanford university study found employee productivity significantly declines hour mark reached given work week
cnn,president trump made tens millions dollars mar lago club past year financial disclosure form published friday office government ethics shed light trump earned politically significant year career financial disclosure form shows earned income least assets foreign ties royalties titles including america deserve way top earned trump told assets earned trump least million
cnn,wall street analysts starting wonder whether another retailer come higher offer start bidding war raised price target whole foods amazon deal announced raised price target company nearly higher amazon bid would jana say higher offer walmart another amazon rival whole foods wfm stock closed friday rose monday top
cnn,f production india supports thousands lockheed martin f supplier jobs u said lockheed tata confirmed cnnmoney f production india move forward lockheed gets lucrative order one world best known fighter jets could soon built india lockheed tata also talks make f components india air force deal materialize tata spokesman added lockheed martin lmt said monday make classic f aircraft south asian nation indian government grants contract supply fighter jets country air force
cnn,ups typically sees volume double normal levels around christmas related ups unveils saturday delivery new jobsthe surcharges start week november thanksgiving week ground shipments world largest shipping company announced monday much plans hike prices holiday season ups typically negotiates higher rates major customers raised rates individuals united parcel service ups instituting per package surcharges holiday season help cover cost hiring additional workers renting extra planes trucks
cnn,cnn tech samuel burke walks steps take protect hacked
cnn,new advertisement released qatar airways monday strikes overtly political tone saying skies free restrictions addition closing airspace qatar airways saudi arabia uae bahrain also shut airline offices qatar airways hit hard losing destinations flights day comes two weeks several states including united arab emirates saudi arabia bahrain egypt cut diplomatic ties qatar severed transport links qatar state owned airline stepping war words attempts neighbors isolate gulf state
cnn,mitsubishi aircraft corp showing new jet known mrj paris air show week mitsubishi joins big leaguesthe huge japanese conglomerate behind mrj mitsubishi heavy industries mhvyf making complex parts plane makers like boeing decades related boeing takes swing airbus bigger maxwhile built nagoya japan mrj global collaboration one unmistakable feature though sharply aerodynamic nose resembles japan famous bullet trains mitsubishi believes getting back track still big tests go could reveal issues
cnn,personal information almost million registered u voters accidentally exposed online due improperly configured security setting security firm upguard revealed monday leaked information compiled republican data firm deep root analytics two republican contractors included names birth dates addresses voter registration details social media posts deep root said statement data exposed june firm updated security settings putting number context politico reported last october united states little million voters also unknown whether vickery first person notice exposed information
cnn,joshua brown tesla warned seven times put hands back wheel plowed truck crash near gainesville florida may drew attention questions raised safety self driving cars national transportation safety board report deadly crash also found brown hands wheel tesla tsla model seconds minutes car autopilot case car hit trailer truck pulled across lanes traffic intersection agency said drawing conclusions crash happened
cnn,joshua brown tesla warned seven times put hands back wheel plowed truck crash near gainesville florida may drew attention questions raised safety self driving cars national transportation safety board report deadly crash also found brown hands wheel tesla tsla model seconds minutes car autopilot case car hit trailer truck pulled across lanes traffic intersection agency said drawing conclusions crash happened
cnn,mcdonald worked olympics since delivered hamburgers athletes competing winter games grenoble france split takes effect immediately one exception mcdonald mcd still sponsor winter olympics pyeongchang south korea mcdonald operate restaurants olympic park olympic village advertise south korea olympic sponsor mcdonald ran promotion called u wins win time american athlete medal americans food changing sponsorships may normal splits come disappointing viewership olympic games rio
cnn,wish yahoo thought money money money could made using symbol abba instead like alibaba business model fan enigmatic founder jack buy alibaba altaba essentially holding company yahoo remaining shares alibaba shares used known yahoo ticker symbol yhoo started trading monday altaba think alternative alibaba trade symbol aaba yahoo held stakes chinese e commerce giant alibaba baba tech yahoo japan yahof
cnn,best airline north america dozens skytrax awards announced tuesday including one air canada took award best airline north america oscars aviation industry emirates airline year qatar snagged skytrax award best business class glitzy awards ceremony tuesday paris air show qatar airways named airline year international air transport ratings group skytrax related qatar airways fires back arab neighbors borders adqatar airways serves worldwide routes fleet planes according website qatar airways best times worst times
cnn,executives charged include former ceo john varley roger jenkins barclays former head investment banking middle east regulator put case hold however pending outcome criminal investigation conducted serious fraud office shortly investments made barclays made billion loan facility available qatar according serious fraud office bank former executives charged u k serious fraud office conspiracy commit fraud false representation june investment made qatar sovereign wealth fund pair also face second charge conspiracy commit fraud october deal group qatari investors
cnn,wall street analysts starting wonder whether another retailer come higher offer start bidding war raised price target whole foods amazon deal announced raised price target company nearly higher amazon bid would jana say higher offer walmart another amazon rival whole foods wfm stock closed friday rose monday top
cnn,despite trump promises electric utilities expected dump coal businesses individuals adopt solar panels fact projections assume renewable energy subsidies go away eventually paris agreement achieved simple economic reality renewable energy costs poised continue dropping thanks gush investment course solar energy force creating headaches coal beleaguered workforce key solar technology become efficient thanks flood money investing renewable energy
cnn,download cnn moneystream minute market data news barclays fraud charges british prosecutors filed criminal charges barclays bclyfthe executives charged include former ceo john varley lockheed martin scores paris lockheed martin lmt says working tata make f fighters india tries beat saab deal supply country military forecast real gdp growth germany year higher rate previously expected stock market movers chipotle chipotle cmg shares dropped extended trading company said spending marketing promotions tries recover e coli outbreak
cnn,six months top tech ceos met president trump first time came back round two one source works tech companies policy issues stressed continues issues like modernizing government tech trump find common ground even disagree others related silicon valley impossible balancing actfor large tech companies difficult impossible sever ties white house completely facebook one top five tech companies attend hope build working relationship white house bipartisan issue modernizing government
cnn,industry leaders started calling next year series started boeing new boeing jet become anticipated airplane commercial aviation related expect paris air showdetails still far boeing talked potential customers world given peek boeing plans new small twin aisle aircraft unofficially dubbed boeing ba released first image new middle market airplane paris air show tuesday teaser company first new airliner since dreamliner
cnn,nsx honda hmc luxury division futuristic hybrid supercar three electric motors turbocharged v engine miles per gallon city highway fuel efficient exotic car still looks drives like exotic car little nicer descriptions practical aspects must include qualifier exotic car looking excuse go visit mother hometown someone handed keys acura nsx
cnn,gallup poll u employees said work hours week put hours tend get distracted typical working hours along lines may want take step back think working many hours first place gone days strolling work sharp clocking precisely eight hours later stanford university study found employee productivity significantly declines hour mark reached given work week
cnn,know interest rate sure know interest rate card hand interest promotional period interest card interest rate changes deferred interest card could cost quite bit paying attention deferred interest card rate remains throughout look keywords card offers include word tend deferred interest arrangements
cnn,stocks traditional grocery stores like kroger clobbered friday deal announced amazon already relatively small grocery business amazon fresh acquisition whole foods much ominous sign competitors walmart boosted grocery business private companies like trader joe also offered tough competition food stocks also sank even buying whole foods amazon invested heavily food delivery business
cnn,white house press secretary getting point kind useless acosta gaggle https co blfwud b cnn newsroom cnnnewsroom june white house press secretary getting point brooke kind useless concluded related camera audio broadcast white house keeps undermining press briefingbut american public get see spicer white house press secretary dealt questions monday acosta thoughts white house white house behind said turning part back camera gesturing towards building yet another day white house refused conduct briefing camera even allow audio briefing broadcast cnn jim acosta let known enough
cnn,one oldest largest events kind paris air show attracted unusual planes years related expect paris air show click images see unusual aircraft appearing past paris air shows return visitor every paris air show since typically seats passengers compared generally holds
cnn,warmbier death comes less month two u congressmen introduced bill aimed banning american tourists visiting north korea devastating loss otto warmbier life led us reconsider position accepting american tourists said statement related warmbier death raises pressure white houseif trump administration wants punish north korea treatment warmbier would need beijing help otto warmbier arrested north korea sightseeing tour last year related u lawmakers want ban american tourists north koreabut american tourists make small fraction visitors north korea whose tourism industry dominated visitors china main economic partner
cnn,ups typically sees volume double normal levels around christmas related ups unveils saturday delivery new jobsthe surcharges start week november thanksgiving week ground shipments world largest shipping company announced monday much plans hike prices holiday season ups typically negotiates higher rates major customers raised rates individuals united parcel service ups instituting per package surcharges holiday season help cover cost hiring additional workers renting extra planes trucks
cnn,joshua brown tesla warned seven times put hands back wheel plowed truck crash near gainesville florida may drew attention questions raised safety self driving cars national transportation safety board report deadly crash also found brown hands wheel tesla tsla model seconds minutes car autopilot case car hit trailer truck pulled across lanes traffic intersection agency said drawing conclusions crash happened
cnn,monday supreme court ruled sex offenders broadly banned using social media supreme court ruling major milestone internet era among first decisions target social media use lot ways constitutional coming party social media companies said alex abdo senior staff attorney knight first amendment institute columbia university opinion kennedy said cyberspace social media particular important places exchanging views first amendment ruling sets precedent denying access social media sites raises questions role public forum
cnn,first meeting american technology council tech ceos industry leaders gave advice modernizing government tech infrastructure
cnn,orlando tourist town known says bruce elliott president orlando regional realtor association means plenty opportunity potential homeowners land good job ease burden saving payment buying house new homeowners find plenty area lively nightlife beaches short drive away booming health education technology industries well several massive infrastructure projects underway helped push orlando unemployment rate
cnn,sean spicer time press secretary eventful watch controversial moments
cnn,qatar airways awarded airline year skytrax paris airshow
cnn,lawrence donnell argues many trump lawyers lack experience abilities properly defend president robert mueller hired dream team experienced lawyers doj government bodies handle russia probe moreduration video duration momentjs
nbc,lawrence donnell argues many trump lawyers lack experience abilities properly defend president robert mueller hired dream team experienced lawyers doj government bodies handle russia probe moreduration video duration momentjs
nbc,overwhelmed generosity people offering donations supplies affected grenfell tower fire inside mall sorts set people lived doomed grenfell tower well nearby buildings london flood generosity aimed lost everything london high rise fire provoked unexpected message donations piled westway sports centre near london grenfell tower clothing supplies stored near grenfell tower london
nbc,related nbc confronts fugitive cop killer cuba part onemontes sentenced years prison due released spokesman said united states continues seek return cuba fugitives u justice espionage compromised many aspects america efforts spy cuba calling question reliability u intelligence collected cuba according michelle van cleave former national counterintelligence executive part american officials say u interested getting back americans sought refuge cuba u prosecution department repeatedly raises fugitive cases cuban government continue every appropriate opportunity
nbc,pew study relatively simple gather data state four categories incarceration drug offenders overdose deaths drug arrests drug use researchers pew charitable trusts crunched state state data drug imprisonment drug use overdoses drug arrests found evidence affected one another example louisiana state highest incarceration rate middle pack overdoses drug arrests drug use theory gelb said deterrence worked states highest incarceration rates would lower rates drug use colorado highest rate drug use th incarcerations
nbc,even consider competitive person chances found situation friend felt competitive spirit bubbling healthy competition drive friends work together therefore improve health side side explains healthy competition friends inspires sides absolute best says dr nikole benders hadi psychiatrist doctor demand healthy competition drive friends work together improving health side side healthy competition friends aware transparent competitiveness says lenderman
nbc,latest signal deteriorating relations superpowers following zigzagging path u foreign policy president donald trump mid april trump told associated press think nafta catastrophic trade deal united states campaign trump wrote op ed wall street journal accusing china raping country manipulating currency trump campaigned strongly north american free trade agreement threatening withdraw united states u canada mexico deal october debate hillary clinton trump went far suggest aligning united states syria isis disagreeing running mate mike pence
nbc,latest signal deteriorating relations superpowers following zigzagging path u foreign policy president donald trump mid april trump told associated press think nafta catastrophic trade deal united states campaign trump wrote op ed wall street journal accusing china raping country manipulating currency trump campaigned strongly north american free trade agreement threatening withdraw united states u canada mexico deal october debate hillary clinton trump went far suggest aligning united states syria isis disagreeing running mate mike pence
nbc,play facebooktwitterembed timeline otto warmbier north korean captivity autoplay autoplay copy code website blogpoliticians condemned north korea otto warmbier year old student returned unconscious state last week north korea died monday family said young pioneer tours chinese travel agency organized trip north korea included warmbier told nbc news monday night would longer offer north korean tours u citizens saying assessment risk americans visiting north korea become high warmbier student university virginia detained pyongyang january tourist trip north korea hold north korea accountable otto warmbier unjust imprisonment demand release three americans illegally detained tillerson said statement
nbc,president trump job approval numbers stand percent according latest cbs news poll moreduration video duration momentjs panel discusses
nbc,try using emojis tried becoming morning people burn calories walking stage fright better lunge take peek inside radio host elvis duran lively office office jerk research suggests cut snacking work yes love job probably know secret eating healthy better pigeon pose surprised find hidden sugars foods better way use snapchat try tips stop complaining get leg raises want sex
nbc,errorwe sorry link followed may broken expired hit browser back button return solid ground take look homepage today top news
nbc,otto warmbier dies return north koreaamerican student otto warmbier died released u following month captivity north korea tensions running high nation looks president donald trumps response nbcs andrea mitchell reports today
nbc,trump agenda senate gop health care outline expected soonleigh ann caldwell kasie hunt garrett haake latest republicans health care vote next week post courier notes trumps agenda particularly health care played race taxes secondary health care policy issues failure health care would create complications tax bill might also create new sense urgency races big day georgiaga big day gop bill yet public see even rank file republicans yet see text legislation
nbc,subject white house hit squad nixon ellsberg said daniel ellsberg former military analyst leaked pentagon papers says knew president richard nixon white house wanted shut related memo shows watergate prosecutors evidence nixon white house plotted violencean accompanying memo akerman summarizes interview stone said helped organize young republicans join counter demonstration apparent knowledge white house plot ellsberg read prosecutors memo investigation assault anti war demonstrators may used say nobody got hurt watergate ellsberg told nbc news phone interview monday evening daniel ellsberg co defendant pentagon papers case talks media outside federal building los angeles april
nbc,cover carlos khalil guzman photo series muslims america carlos khalil guzmanif tell someone muslim community diverse people think okay diverse maybe middle eastern south asian said carlos khalil guzman fighting islamophobia camera portraits muslims america photo series carlos khalil guzman carlos khalil guzmanentirely self funded guzman spent past year half crisscrossing country weekends days full time job photography studio new york muslims america guzman also hopes showcase diversity muslim community ethnicity gender geography life experience special focus women said often targets prejudice highlighting muslim communitys diversity images rather words guzman hopes break stereotypes
nbc,senior white house adviser jared kushner president son law leads inaugural meeting american technology council monday alphabet inc executive chairman eric schmidt center listens white house senior adviser jared kushner speaks opening session white house meeting technology chief executive officers mark technology week monday june indian treat room eisenhower executive office building white house complex washington president donald trump summoned technology team white house monday first meeting american technology council continuing delicate relationship administration silicon valley also chance jared kushner president son law senior adviser heading american technology council make rare public remarks tesla spacex ceo elon musk quit two trump advisory councils president paris climate decision
nbc,poke holes near bottom edge toilet paper roll using thumb tacks use stabilize speaker follow steps quick speaker pinch watch video carefully cut notch toilet paper roll marked width phone mark width phone outside toilet paper roll grab empty toilet paper roll
nbc,reports say senator mcconnell hopes healthcare vote july th recess written text guarantee republicans votes needed pass anything moreduration video duration momentjs
nbc,moreduration video duration momentjs stakes high expensive house race ever
nbc,find complaining someone try find reasons feel grateful person minor gripes try gratitude rubin said great way change emotions situation youre thinking someone done feel differently things would complaining rubin explained instance rubin said youre frustrated everyone always seems late staff meeting perhaps time meeting changed finally relent give good complaining session
nbc,thing thing president trump bragged good job building panama canal moreduration video duration momentjs yes one hundred years ago replied panamanian president
nbc,nicolle wallace bragging rights stake georgias special electionpolitical analyst nicolle wallace says georgias special election would symbolic victory democrats jon ossoff wins explains whats stake political party
nbc,public debate regarding whether washington name logo actually offends native americans bubbles time time ive personally chosen avoid using term deference native americans actually genuinely offended term posted mike florio june pm edtthe long winding road regarding whether washington lose federal trademark protection name logo isnt officially essentially u supreme court ruled case involving name band slants may offensive asian americans guarantee free speech first amendment overcomes governments supposed ability invalidate trademark rights potentially offensive grounds upsets people choose use
nbc,nerdwallet analysis mentioned studied overdraft fees late fees late payments result fees lower credit score time total u college students spend million year overdraft late payment fees u college students spend million year overdraft late payment fees overdraft late payment fees one protecting overdraft fees
nbc,carrie fisher cocaine methadone system autopsy showsthe star wars actress suffered appeared cardiac arrest airplane coroners report said fisher additionally tested positive cocaine methadone alcohol opiates
nbc,planets characterized nasa kepler mission yellow dots surveys split several different broad planet types according researchers kepler discovered percent planet candidates confirmed exoplanets ever found eighth kepler planet catalog includes new planet candidates less twice sized earth stars habitable zone editor note article updated p edt include details background nasa press conference researchers also revealed surprising divide small earth like planets mini neptunes gleaned data
nbc,related whats next fight puerto rico statehood doesnt would mean end statehood movement opening renewed focus possibilities independence united states congress rejects request statehood would mean statehood leaders said would turn independence add puerto ricos resident commissioner puerto rican congressional delegation statehood supporters first statehood movement since tied argument decolonization
nbc,outlines vets benefit new unified health recordsveterans affairs secretary david shulkin announces department adopt electronic health system department defense allowing seamless transfer information military enlistment veterans death
nbc,also asked health care bill alter veterans health care washington republicans preparing series votes next week plan overhaul nation health care system bernie sanders vt elizabeth warren mass using profiles publicly draw opposition health care bill including facebook live event monday afternoon gop bill yet public see even rank file republicans yet see text legislation republicans wont relent debate health care bill open american people see shouldnt expect business usual senate said schumer
nbc,watch days top stories analysis help wrap day
