text,type
,
wiki,love song flo twenty second single rhythm zone contains new songs next album cosmicolor remix lotta love instrumentals released november first pressings single include cd extra footage live summer time love performance love song bonnie pink twenty sixth single
wiki,season nd season competitive football rangers
wiki,afromarengo plana jumping spider species genus afromarengo lives south africa
wiki,grisana genus moths noctuidae family
wiki,kshatriya kulavatauns title nobility conferred upon seventeenth century indian warrior king chhatrapati shivaji raje bhosale means head chief kshatriya race kshatriya one four varnas hinduism kulavantas means head kula race title continues used shivajis descendants
wiki,robert sands estate historic home located rhinebeck dutchess county new york house built story brick filled wood frame building gable roof sheathed clapboard sat extant stone foundation measured five bays wide four deep also property contributing story frame cottage four frame farm outbuildings including dutch barn added national register historic places national park service oversees register announced considering request remove result fire left foundation august year
wiki,cowboy ninja viking image comics comic book created writer j lieberman artist riley rossmo series debuted released image comics partner studio shadowline
wiki,das kriminalmuseum german television series ran zdf one first programs episode began tracking shot unspecified crime museum stopping one displays whose story told episode minutes long featured different actors criminal commissioner best known erik ode moved der kommissar appearing episodes theme music series written german composer martin bottcher also composed complete scores five episodes
wiki,universal music latin entertainment division universal music group vivendi record company specialized producing distributing latin music mexico united states puerto rico umle includes famous latin music labels universal music latino fonovisa records universal music mexico capitol latin machete music disa records record company created acquisition univision music group combining universal top latin artists along much latin back catalog umg
wiki,molineux stadium mlnju mol new championship football stadium situated wolverhampton england home ground wolverhampton wanderers football club since long history first stadium ever built football league one first grounds country install floodlights well hosting first european club games time multimillion pound renovation early molineux one biggest modern stadia england though since eclipsed many ground developments stadium however hosted england internationals recently england internationals well first uefa cup final although currently seater stadium record attendance molineux stands initial plans announced may rebuild two sides stadium season increase capacity around first stage project began summer completed course start season also provisional future plans longer term redevelopment every stand could potentially create capacity
wiki,americo sebastiano costantino born october italian american retired professional wrestler wrestling manager performed ring names rico costantino rico world wrestling entertainment wwe currently wrestling future stars wrestling promotion las vegas nevada
wiki,lance edward lem massey september june native syracuse new york child walter griffith massey florence lance massey growing watertown new york attended two years high school watertown entered severn school located severna park maryland graduating severn accepted u naval academy sixteen graduating naval academy given commission ensign ordered battleship uss texas bb serving year aboard uss texas entered flight training pensacola naval air station naval aviator wings january assigned scouting squadron aboard aircraft carrier uss lexington cv next three years ships company uss lexington subsequently served two year tour pensacola naval air station florida flight instructor pensacola married marjorie drake kelsey widow lieutenant j g james kelsey graduate us naval academy june lieutenant jg massey reported observation squadron aboard battleship uss new mexico bb whose home port long beach california august promoted rank lieutenant january observation squadron three transferred uss idaho bb stayed july sent naval air station pensacola october reassigned uss enterprise cv executive officer torpedo squadron six united states attacked japan december serving capacity promoted rank lieutenant commander january active several major actions first seven months february squadron torpedo squadron six consisting nine tbd devastator torpedo planes made first airborne torpedo attack u naval history attack japanese shipping kwajalein atoll marshall islands sank ton japanese transport bordeaux maru awarded distinguished flying cross following month aboard uss enterprise air wing escorted uss hornet cv carried general jimmy doolittles renowned tokyo raiders attacked mainland japan
wiki,neaspilota genus tephritid fruit flies family tephritidae
wiki,faulknor family english family northamptonshire several generations served officers royal navy
wiki,stefan dimle born june koping sweden bassplayer progressive band morte macabre former member landberk paatos driving force company mellotronen also organiser floating rock festival named melloboat held aboard ship galaxy mellotronen runs community mello club cafe stockholm stefan dimle member several local rock bands former hometown borlange one bands kajuku members band currently opeth anekdoten stefan dimle start rock club mellotronen borlange company existed parallel basis stockholm borlange shop huge section rare hard find cds lps field progressive rock mellotronen became important headquarters musicians fans progressive rock shop mellotronen located fashionable street kakbrinken gamla stan center stockholm nowadays one find dimle company city gustavsberg stefan dimle member band landberk recorded three albums two eps various record labels like record heaven mega rock american label laser edge progressive rock groups landberk anglagard anekdoten co operated lot three used instrument mellotron main instrument three groups led way many new bands progressive genre three famous international level label mellotronen started cd reissue solid grounds debut album since dimle released around different cd vinyl albums latest ones double cd trettioariga kriget two albums sabu martinez dimle mellotronen co operated lot labels like universal national swedish radio mnw sony emi together members landberk anekdoten dimle started project morte macabre made career film circuits repertoire new versions old soundtracks mainly italian horror movies band paatos started dimle performed til paatos released four albums inch vinyl single dimle also performed emma nordenstam machine said behold turid onkel kankel kankelbar january organised dimle rock festival board ship silja festival celebrate th anniversary mellotronen company among many artists performed board following ones mentioned flasket brinner november asoka morte macabre solid ground emma nordenstam march time nd rock cruise ship silja symphony many people came see bands like opeth katatonia comus april third rock cruise supposed take place destination finland time board galaxy however months date dimle announced melloboat cancelled among many artist supposed perform cruise meshuggah may blitz steven wilson
wiki,holzdorf village municipality jessen elster district wittenberg german state saxony anhalt inhabitants previously separate municipality district kremitz became part amalgamated municipality jessen march holzdorf various shops doctors offices regional center surrounding villages addition farming nearby schonewalde holzdorf air base staff main source income residents air base within city schonewalde brandenburg
wiki,tredinnick cornish surname derives one places called tredinnick tredinnick formed elements tre homestead either dynek fortified eythynek overgrown gorse redynek overgrown bracken notable people surname include david tredinnick actor australian actor david tredinnick politician born british politician mark tredinnick born australian poet writer miles tredinnick born english musician stage screen writer noel tredinnick born english organist composer
wiki,scottish cup th season scotland prestigious football knockout competition cup rangers beat kilmarnock final
wiki,gunther schmidt rudersdorf near berlin german mathematician works also informatics
wiki,robert sargent electrical engineer defense department defensive weapons specialist published poet lived adult life washington dc
wiki,broken rites formally broken rites australia collective inc australian non profit organisation dedicated exposing denouncing cases catholic sexual abuse scandal
wiki,deep six song american rock band marilyn manson song released digital outlets december second single band ninth studio album pale emperor music video directed bart hess released youtube song hit american active rock radio peaking number eight billboard mainstream rock becoming band highest peaking single ever chart
wiki,usa also known gps iir gps svn american navigation satellite forms part global positioning system eleventh block iir gps satellite launched thirteen original configuration twenty one overall built lockheed martin using satellite bus usa launched utc march atop delta ii carrier rocket flight number flying configuration launch took place space launch complex b cape canaveral air force station placed usa transfer orbit satellite raised medium earth orbit using star fm apogee motor may usa orbit perigee kilometres mi apogee kilometres mi period minutes degrees inclination equator used broadcast prn signal operates slot plane c gps constellation satellite mass kilograms lb design life years remains service
wiki,luan county station chinese chinese railway station located luan county jingha railway
wiki,stanek stank village administrative district gmina michaowo within biaystok county podlaskie voivodeship north eastern poland close border belarus lies approximately kilometres mi north west michaowo km mi east regional capital biaystok
wiki,carlo pezzati october italian politician mayor italian city piacenza carlo born pio defina elmonti pezzati village torre gandini outside piacenza would eventually become mayor piacenza killed partisans laid rest cemetery torre gandini
wiki,john william moore june december u representative kentucky born morgantown kentucky moore attended public schools completed commercial course bryant stratton college louisville became clerk morgantown deposit bank engaged timber business cashier morgantown deposit bank moore elected democrat sixty ninth congress special election fill vacancy caused death united states representative robert thomas jr reelected succeeding congress december march unsuccessful candidate reelection seventy first congress moore elected democrat seventy first congress special election fill vacancy caused death united states representative charles w roark reelected succeeding congress june march candidate renomination seventy third congress resumed former business pursuits employed federal housing administration washington c assistant comptroller died washington c december interred morgantown cemetery morgantown kentucky
wiki,th division spanish division division spanish republican army spanish civil war formed april aragon militarized columna durruti reorganization spanish republican armed forces th division included th th st mixed brigades throughout civil war fought huesca offensive battle belchite aragon offensive battle segre finally disbanded february withdrawal rush border followed rebel catalonia offensive
wiki,pelham range small mountain range southern vancouver island british columbia canada located northeast sarita sarita river alberni inlet area km subrange vancouver island ranges turn form part insular mountains
wiki,katzenthal commune haut rhin department grand est north eastern france
wiki,psyrassa sallaei species beetle family cerambycidae
wiki,juan manuel coello torres born may retired honduran association footballer currently coach motagua reserves team
wiki,holy trinity church church scotland parish church st andrews fife category listed building
wiki,athyma glora species nymphalid butterfly
wiki,amanda nicole poach born july american soccer player bowie maryland poach represented united states fifa u women world championship team finished fourth place
wiki,lone shark weekly minute public access television cable tv program broadcast ten years wfac tv soundview community television television stations part cablevision southern connecticuts cable system spans southwestern coast connecticut new york state border middle new county lone shark hosted program creator executive producer jim sharky co hosted program producer sean haffner k sean producer although program unscripted sharky would usually list topics wanted discuss haffner episode lone shark known fast pace strong language adult themes often pushing limits station managers believed could allowed television lone shark originally recorded studio location edited broadcast program broadcast live without broadcast delay editing censor august program permanently suspended production soundview television station management lone shark aired three seconds graphic adult sex video live television prime time
wiki,peppy peppermint polar bear mascot icon fox glacier mints brand boiled mint manufactured fox confectionery united kingdom peppy introduced confectionery packaging around time fox commissioned taxidermist shoot stuff real polar bear put display public events football matches carnivals advertise glacier mints exhibition taken country eventually incorporated many four stuffed polar bears advent televised advertising rowntrees acquired company exhibition deemed politically incorrect removed public circulation television commercials featured peppy later produced original peppy measuring ft high ft long indeterminate gender donated new walk museum leicester city fox confectionery based stuffed bear lost company factory approximately years brand manager said donation found back clearing decided donate museum best place want reception gory feared could scare customers visited acquisition museum commenced restoration process took six years complete peppy displayed public exhibition museum january april
wiki,earl thomas ferrell born march halifax virginia former professional american football player selected st louis cardinals th round nfl draft ft lbs running back east tennessee state ferrell played entire nfl career cardinals led cardinals running backs rushing yards seasons team first two years playing phoenix second player one four school history selected draft play nfl playing college football etsu despite pro bowl appearance final two seasons ferrell career cut short due problems illegal drugs ferrell reportedly tested positive three times cocaine prior season suspended one year due another failed drug test never played nfl getting news suspension ferrell chose retire
wiki,happy people go third studio album american soul disco group trammps released atlantic records
wiki,decellularization porcine heart valves removal cells along antigenic cellular elements either physical chemical decellularization tissue decellularized valve tissue provides scaffold remaining extracellular matrix ecm used tissue engineering valve replacement humans inflicted valvular disease decellularized biological valves potential benefit conventional valves decreased calcification thought immuno inflammatory response initiated recipient
wiki,charley aunt farce three acts written brandon thomas broke historic records plays kind original london run performances play first performed theatre royal bury st edmunds february produced former oyly carte opera company actor w penley friend thomas appeared principal role lord fancourt babberley undergraduate whose friends jack charley persuade impersonate latter aunt piece success opened london royalty theatre december quickly transferred larger globe theatre january complete record breaking run play success broadway another long run also toured internationally revived continually adapted films musicals
wiki,francois lesieur desaulniers august quebec farmer political figure born yamachiche served lieutenant colonel local militia married charlotte daughter augustin rivard represented saint maurice legislative assembly desaulniers elected legislative assembly lower canada saint maurice election member parti patriote elected legislative assembly province canada region died yamachiche son louis leon member canadian house commons
wiki,choanoderm type cell layer composed flagellated collar cells choanocytes found sponges
wiki,article presents lists literary events publications
wiki,sawoszewek swavvk village administrative district gmina kleczew within konin county greater poland voivodeship west central poland lies approximately kilometres mi north kleczew km mi north konin km mi east regional capital poznan village population
wiki,valdres videregaande skule high school located valdres area eastern norway school primary high school vast majority students greater valdres area offers relatively broad range subjects since distances area quite big many students live small apartments closer school e g students areas farthest away may take hour travel every day bus get school school split two sections one leira another fagernes new building heavy investment municipal extended leira section cover students time writing principal kari elisabeth rustad student count generally around
wiki,nalkheda village bhopal district madhya pradesh india located berasia tehsil
wiki,puerto rican nationalist party revolts series coordinated armed protests independence puerto rico led president puerto rican nationalist party pedro albizu campos united states government rule island party repudiated free associated state estado libre asociado status enacted nationalists considered continuation colonialism party organized series uprisings take place various puerto rican cities october uprisings suppressed strong ground air military force command puerto rico national guard major general luis r esteves related event november year two nationalists new york city attempted storm blair house failed effort assassinate u president harry truman supported puerto rican government effort draft constitution would rename local government commonwealth united states provide limited local autonomy nearly puerto rican voters approved constitution estado libre associado nationalists considered outcome vote political farce since referendum offered option vote favor independence statehood restricting choices two continuation colonial status existing time proposed new commonwealth status march another armed assault four nationalists fired shots visitors gallery house representatives united states capitol full floor debate wounding five congressmen one seriously nationalists protesting perceived continuation colonial status puerto rico
wiki,sleeps song american heavy metal band metallica album load band first number one song us billboard hot mainstream rock tracks chart well first song release death magnetic hit top billboard hot debuting peaking number
wiki,rising sun high school public high school rising sun indiana part rising sun ohio county community schools high school ohio county
cnn,warmbier death comes less month two u congressmen introduced bill aimed banning american tourists visiting north korea devastating loss otto warmbier life led us reconsider position accepting american tourists said statement related warmbier death raises pressure white houseif trump administration wants punish north korea treatment warmbier would need beijing help otto warmbier arrested north korea sightseeing tour last year related u lawmakers want ban american tourists north koreabut american tourists make small fraction visitors north korea whose tourism industry dominated visitors china main economic partner
cnn,personal information almost million registered u voters accidentally exposed online due improperly configured security setting security firm upguard revealed monday leaked information compiled republican data firm deep root analytics two republican contractors included names birth dates addresses voter registration details social media posts deep root said statement data exposed june firm updated security settings putting number context politico reported last october united states little million voters also unknown whether vickery first person notice exposed information
cnn,megyn kelly much talked interview alex jones got plenty attention kelly nbc good bad many viewers fewest viewers kelly weekly news magazine telecast sunday night megyn kelly drawn since debut three weeks ago show also trailed run episode cbs minutes brought million viewers kelly sit jones controversial conspiracy theorist radio host founder website infowars brought average million viewers sunday night episode drew average million viewers
cnn,iss argued wells fargo board made scandal worse failing provide oversight could limited damage federal reserve must hold wells fargo board members accountable risk management failures warren wrote letter first reported cnbc elizabeth warren livid wells fargo demanding government take dramatic step throwing board directors wells fargo acknowledged firing workers creating million fake accounts instance wells fargo eliminated unrealistic sales goals promoted sloan ceo encouraged workers speak bad behavior
cnn,monday supreme court ruled sex offenders broadly banned using social media supreme court ruling major milestone internet era among first decisions target social media use lot ways constitutional coming party social media companies said alex abdo senior staff attorney knight first amendment institute columbia university opinion kennedy said cyberspace social media particular important places exchanging views first amendment ruling sets precedent denying access social media sites raises questions role public forum
cnn,nsx honda hmc luxury division futuristic hybrid supercar three electric motors turbocharged v engine miles per gallon city highway fuel efficient exotic car still looks drives like exotic car little nicer descriptions practical aspects must include qualifier exotic car looking excuse go visit mother hometown someone handed keys acura nsx
cnn,despite trump promises electric utilities expected dump coal businesses individuals adopt solar panels fact projections assume renewable energy subsidies go away eventually paris agreement achieved simple economic reality renewable energy costs poised continue dropping thanks gush investment course solar energy force creating headaches coal beleaguered workforce key solar technology become efficient thanks flood money investing renewable energy
cnn,despite trump promises electric utilities expected dump coal businesses individuals adopt solar panels fact projections assume renewable energy subsidies go away eventually paris agreement achieved simple economic reality renewable energy costs poised continue dropping thanks gush investment course solar energy force creating headaches coal beleaguered workforce key solar technology become efficient thanks flood money investing renewable energy
cnn,valuation billion last time blue apron raised money private investors maybe buffett one day blue apron stock delivered portfolio blue apron mention whole foods amazon name recent sec filing blue apron prices offering midpoint raise million market value billion blue apron expecting big delivery greens
cnn,personal information almost million registered u voters accidentally exposed online due improperly configured security setting security firm upguard revealed monday leaked information compiled republican data firm deep root analytics two republican contractors included names birth dates addresses voter registration details social media posts deep root said statement data exposed june firm updated security settings putting number context politico reported last october united states little million voters also unknown whether vickery first person notice exposed information
cnn,leaving eu means britain longer free access market bruegel influential think tank estimated size final bill billion billion billion billion related eu citizens leaving brexit britainin position paper published earlier month eu said wants broad rights citizens eu britain well families eu requires nations access free trading bloc accept free movement people britain might allowed pay access eu market would require concessions key areas
cnn,boeing shows latest jetliners dreamliner max ahead paris air show
cnn,know interest rate sure know interest rate card hand interest promotional period interest card interest rate changes deferred interest card could cost quite bit paying attention deferred interest card rate remains throughout look keywords card offers include word tend deferred interest arrangements
cnn,white house press briefing dates back presidency william mckinley become hallmark american politics white house press briefing seen better days first time white house taken step month brought added twist monday briefing white house termed gaggle informal set though took place format much like briefing likewise camera audio broadcasting forbidden response networks like cnn decided broadcast audio briefing even without visual accompany white house barred attendees
